{
  "protocolVersion": "1.0",
  "datasetId": "devorbit-public-software-repair-v1",
  "status": "protocol-only",
  "disclosure": "The scored benchmark manifest is not frozen and contains no scored case or method result. One separately declared SWE-bench dev validation pilot has frozen provenance and a reproduced baseline failure; it is not a DevOrbit score or test-set claim.",
  "selectionPolicy": {
    "eligibility": [
      "Public repository and issue provenance are available under a redistributable research-compatible license",
      "The defect reproduces from an immutable base commit with a deterministic test patch",
      "The expected fix commit is available to the evaluator but hidden from every evaluated method"
    ],
    "exclusions": [
      "Cases requiring unavailable proprietary services or personal data",
      "Cases that do not reproduce in the pinned container after three independent attempts"
    ],
    "splitSeed": "devorbit-public-v1-split",
    "splitAlgorithm": "repository-grouped deterministic SHA-256 ordering; no repository may cross train/validation/test"
  },
  "evaluationPolicy": {
    "goldFixAccess": "evaluator-only",
    "networkAccess": "disabled",
    "maxAttemptsPerCase": 1,
    "timeoutSeconds": 1800,
    "primarySplit": "test",
    "primaryMetric": "closedLoopRate"
  },
  "sources": [
    {
      "id": "swe-bench",
      "name": "SWE-bench",
      "url": "https://huggingface.co/datasets/princeton-nlp/SWE-bench",
      "license": "Pinned dataset card does not declare a dataset license; SWE-bench software repository currently declares MIT",
      "snapshot": null,
      "retrievedAt": null
    },
    {
      "id": "bugs-in-py",
      "name": "BugsInPy",
      "url": "https://github.com/sohah/bugsInPy",
      "license": "See upstream repository license at the pinned snapshot",
      "snapshot": null,
      "retrievedAt": null
    }
  ],
  "splits": {
    "train": [],
    "validation": [],
    "test": []
  },
  "cases": []
}
